{
  "schemaVersion": "tidy.product-prototype-cohort/v1",
  "cohortId": "prisoners-australia-preliminary-anzsoc-2023-table-2",
  "publicationId": "prisoners-australia",
  "tableFamilyId": "preliminary-anzsoc-2023-table-2",
  "generation": {
    "provider": "openai-codex",
    "model": "openai-codex/gpt-5.6-luna",
    "reasoning": "high",
    "promptContract": "cell-role-semantic-map-v13-adjacent-year-aware",
    "maximumCalls": 2,
    "maximumCostUsd": 2.0,
    "correctionPolicy": "one-pre-execution-compilation-correction-only"
  },
  "acceptanceContract": "acceptance/prisoners-preliminary-anzsoc-2023-table-2-v1.json",
  "workbooks": [
    {
      "year": 2025,
      "referenceDate": "2025-06-30",
      "path": "workbooks/prisoners-australia-2025-preliminary-anzsoc-2023-source.xlsx",
      "contentDigest": "sha256:73d729ea81b95e9d8e09f3c26fa980b120bcf033cfae5831e3cf2f50f8ae29dc",
      "byteLength": 64466,
      "sheet": "ANZSOC 2023 Table 2",
      "replayResponse": {
        "path": "replay/prisoners-australia-preliminary-anzsoc-2023-2-2025.response.txt",
        "contentDigest": "sha256:ca28e68e2e2f6a41c39925a33a825dc549e5270c717520d2a6b65f20ffa65a46",
        "byteLength": 483,
        "historicalModel": "human-authored/deterministic-geometry-v1",
        "acceptanceAuthority": false
      }
    }
  ]
}
