{
  "schemaVersion": "tidy.product-prototype-cohort/v1",
  "cohortId": "prisoners-australia-table-30-2023-2025",
  "publicationId": "prisoners-australia",
  "tableFamilyId": "prisoners-by-jurisdiction-indigenous-status-sex-legal-status",
  "generation": {
    "provider": "openai-codex",
    "model": "openai-codex/gpt-5.6-luna",
    "reasoning": "high",
    "promptContract": "cell-role-semantic-map-v13-adjacent-year-aware",
    "maximumCalls": 6,
    "maximumCostUsd": 2.0,
    "correctionPolicy": "one-pre-execution-compilation-correction-only"
  },
  "acceptanceContract": "acceptance/prisoners-table-30-v1.json",
  "workbooks": [
    {
      "year": 2023,
      "referenceDate": "2023-06-30",
      "path": "workbooks/prisoners-australia-2023.xlsx",
      "contentDigest": "sha256:59afcaf8a0c52a2754f75954ce5821611ee735f329d90d0e4b80c3dead0827af",
      "byteLength": 335227,
      "sheet": "Table_30",
      "replayResponse": {
        "path": "replay/prisoners-australia-2023.response.txt",
        "contentDigest": "sha256:623ea2bdb9d8bb49859e91c214040b54f78d596a3fa7f1701ed3dfd7c4d93e5c",
        "byteLength": 1036,
        "historicalModel": "openai-codex/gpt-5.6-sol",
        "acceptanceAuthority": false
      }
    },
    {
      "year": 2024,
      "referenceDate": "2024-06-30",
      "path": "workbooks/prisoners-australia-2024.xlsx",
      "contentDigest": "sha256:609a96a96e2e359ae3e534252bcb1a6b6a329eb91fcf289834d1014dc61273d1",
      "byteLength": 279279,
      "sheet": "Table 30",
      "replayResponse": {
        "path": "replay/prisoners-australia-2024.response.txt",
        "contentDigest": "sha256:ce2df2e306f6c6c0389406d307d4468772434d24c553f68833456c35f4515dab",
        "byteLength": 1098,
        "historicalModel": "openai-codex/gpt-5.6-sol",
        "acceptanceAuthority": false
      }
    },
    {
      "year": 2025,
      "referenceDate": "2025-06-30",
      "path": "workbooks/prisoners-australia-2025.xlsx",
      "contentDigest": "sha256:f326cef55f707ca0d15f8fa489cadc839c498c1b8e6fa696e0c15f39ec4c8549",
      "byteLength": 185197,
      "sheet": "Table 30",
      "replayResponse": {
        "path": "replay/prisoners-australia-2025.response.txt",
        "contentDigest": "sha256:ae7d1c7df1984c4095c471af2312ef99bf1ded861e02b2e46b2da0bfd061d458",
        "byteLength": 650,
        "historicalModel": "openai-codex/gpt-5.6-sol",
        "acceptanceAuthority": false
      }
    }
  ]
}
