{
  "schemaVersion": "tidy.product-prototype-cohort/v1",
  "cohortId": "prisoners-australia-table-23-2021-2025",
  "publicationId": "prisoners-australia",
  "tableFamilyId": "sentenced-prisoners-by-most-serious-offence-and-jurisdiction",
  "generation": {
    "provider": "openai-codex",
    "model": "openai-codex/gpt-5.6-luna",
    "reasoning": "high",
    "promptContract": "cell-role-semantic-map-v13-adjacent-year-aware",
    "maximumCalls": 10,
    "maximumCostUsd": 2.0,
    "correctionPolicy": "one-pre-execution-compilation-correction-only"
  },
  "acceptanceContract": "acceptance/prisoners-table-23-v1.json",
  "workbooks": [
    {
      "year": 2021,
      "referenceDate": "2021-06-30",
      "path": "workbooks/prisoners-australia-2021.xlsx",
      "contentDigest": "sha256:cd7b352a428bd55a23baf991620b9473fd6693a904ff4226e2eb6c68e7e747bd",
      "byteLength": 346875,
      "sheet": "Table_23",
      "replayResponse": {
        "path": "replay/prisoners-australia-table-23-2021.response.txt",
        "contentDigest": "sha256:ef0367daa3bcac5a2f07d2289979f76ad620574f7be20d18e2105b053162f6e8",
        "byteLength": 873,
        "historicalModel": "openai-codex/gpt-5.6-sol",
        "acceptanceAuthority": false
      }
    },
    {
      "year": 2022,
      "referenceDate": "2022-06-30",
      "path": "workbooks/prisoners-australia-2022.xlsx",
      "contentDigest": "sha256:6df72fa38f0fc5cc2c5c322c0e20655c3685e41281a6cab4f78c59ae44173c9c",
      "byteLength": 363962,
      "sheet": "Table_23",
      "replayResponse": {
        "path": "replay/prisoners-australia-table-23-2022.response.txt",
        "contentDigest": "sha256:f4d981b8f7907efaa9dabb985ef6a2e0e8ac012005758ce5c3011ba7dd6d47f9",
        "byteLength": 914,
        "historicalModel": "openai-codex/gpt-5.6-sol",
        "acceptanceAuthority": false
      }
    },
    {
      "year": 2023,
      "referenceDate": "2023-06-30",
      "path": "workbooks/prisoners-australia-2023.xlsx",
      "contentDigest": "sha256:59afcaf8a0c52a2754f75954ce5821611ee735f329d90d0e4b80c3dead0827af",
      "byteLength": 335227,
      "sheet": "Table_23",
      "replayResponse": {
        "path": "replay/prisoners-australia-table-23-2023.response.txt",
        "contentDigest": "sha256:bb611139f11fcdad2e6855050d822e3ca38b9c43ae6cc394cb6d61342c2c0b5b",
        "byteLength": 727,
        "historicalModel": "openai-codex/gpt-5.6-sol",
        "acceptanceAuthority": false
      }
    },
    {
      "year": 2024,
      "referenceDate": "2024-06-30",
      "path": "workbooks/prisoners-australia-2024.xlsx",
      "contentDigest": "sha256:609a96a96e2e359ae3e534252bcb1a6b6a329eb91fcf289834d1014dc61273d1",
      "byteLength": 279279,
      "sheet": "Table 23",
      "replayResponse": {
        "path": "replay/prisoners-australia-table-23-2024.response.txt",
        "contentDigest": "sha256:26bf9848c5a347bf0c729e966dff6b3d5343bd955471925abbe61d3f3df6be73",
        "byteLength": 912,
        "historicalModel": "openai-codex/gpt-5.6-sol",
        "acceptanceAuthority": false
      }
    },
    {
      "year": 2025,
      "referenceDate": "2025-06-30",
      "path": "workbooks/prisoners-australia-2025.xlsx",
      "contentDigest": "sha256:464f80e73901ae9010d2dbbf1fc1bf37222711a3ccacc44efdbe99953aa3d263",
      "byteLength": 169943,
      "sheet": "Table 23",
      "normalization": "trim-pathological-full-width-formatting-merge-v1",
      "replayResponse": {
        "path": "replay/prisoners-australia-table-23-2025.response.txt",
        "contentDigest": "sha256:dfd0c21efe52fc44c1f2fca3b10d05b27411e8a797ff7f0c26e46c4a2cbe7b6f",
        "byteLength": 935,
        "historicalModel": "openai-codex/gpt-5.6-sol",
        "acceptanceAuthority": false
      }
    }
  ]
}
